article_url,title,date,time,section,author,excerpt,text_body,feat_img_link,feat_img_cation,full_text,is_ergatiko
https://www.naftemporiki.gr/society/683778/larisa-sovaro-ergatiko-atychima-se-fourno-to-zymotirio-egklovise-to-cheri-tou/,Λάρισα: Σοβαρό εργατικό ατύχημα σε φούρνο- Το  ζυμωτήριο εγκλώβισε  το χέρι του,2021-06-15,10:59:00,Κοινωνία,,,"Ένα σοβαρό ατύχημα σημειώθηκε σε φούρνο στη Λάρισα, σήμερα το πρωί, με θύμα έναν εργαζόμενο της επιχείρησης. Σύμφωνα με όσα έχουν γίνει γνωστά, το ζυμωτήριο εγκλώβισε το δεξί χέρι του. Το περιστατικό κρίθηκε σοβαρό και για τον απεγκλωβισμό του εργαζόμενου έσπευσαν στο σημείο οκτώ πυροσβέστες. ",https://www.naftemporiki.gr/wp-content/themes/naftemporiki/images/N.PNG,,"Λάρισα: Σοβαρό εργατικό ατύχημα σε φούρνο- Το  ζυμωτήριο εγκλώβισε  το χέρι του Ένα σοβαρό ατύχημα σημειώθηκε σε φούρνο στη Λάρισα, σήμερα το πρωί, με θύμα έναν εργαζόμενο της επιχείρησης. Σύμφωνα με όσα έχουν γίνει γνωστά, το ζυμωτήριο εγκλώβισε το δεξί χέρι του. Το περιστατικό κρίθηκε σοβαρό και για τον απεγκλωβισμό του εργαζόμενου έσπευσαν στο σημείο οκτώ πυροσβέστες. ",True
https://www.naftemporiki.gr/society/585937/ergatiko-atychima-sto-limani-tou-irakleiou/,Εργατικό ατύχημα στο λιμάνι του Ηρακλείου,2018-07-05,15:22:00,Κοινωνία,,,"Εκτός κινδύνου, αλλά με πολλαπλά κατάγματα στο δεξί χέρι και πόδι, μεταφέρθηκε νωρίς το μεσημέρι στο «Βενιζέλειο» Νοσοκομείου Ηρακλείου Κρήτης ένας 57χρονος λιμενεργάτης, που τραυματίστηκε στη διάρκεια εργασιών εκφόρτωσης στο φορτηγό πλοίο «Ζωή» (Ν.Π.), εντός του λιμανιού της πόλης. Σύμφωνα με το Λιμενικό, ο άτυχος άνδρας καταπλακώθηκε από οικοδομικά σίδερα, τα οποία ξεφόρτωνε από το πλοίο γερανός. Κάτω από αδιευκρίνιστες συνθήκες, το συρματόσχοινο του γερανού έσπασε, με αποτέλεσμα το βαρύ φορτίο να πέσει πάνω στον 57χρονο. Προανάκριση διενεργείται από το Κεντρικό Λιμεναρχείο Ηρακλείου. naftemporiki.gr ",https://www.naftemporiki.gr/wp-content/themes/naftemporiki/images/N.PNG,,"Εργατικό ατύχημα στο λιμάνι του Ηρακλείου Εκτός κινδύνου, αλλά με πολλαπλά κατάγματα στο δεξί χέρι και πόδι, μεταφέρθηκε νωρίς το μεσημέρι στο «Βενιζέλειο» Νοσοκομείου Ηρακλείου Κρήτης ένας 57χρονος λιμενεργάτης, που τραυματίστηκε στη διάρκεια εργασιών εκφόρτωσης στο φορτηγό πλοίο «Ζωή» (Ν.Π.), εντός του λιμανιού της πόλης. Σύμφωνα με το Λιμενικό, ο άτυχος άνδρας καταπλακώθηκε από οικοδομικά σίδερα, τα οποία ξεφόρτωνε από το πλοίο γερανός. Κάτω από αδιευκρίνιστες συνθήκες, το συρματόσχοινο του γερανού έσπασε, με αποτέλεσμα το βαρύ φορτίο να πέσει πάνω στον 57χρονο. Προανάκριση διενεργείται από το Κεντρικό Λιμεναρχείο Ηρακλείου. naftemporiki.gr ",True
https://www.naftemporiki.gr/society/557488/thessaloniki-eisangeliki-paremvasi-gia-ergatiko-atychima-stin-ypiresia-kathariotitas-tou-kentrikou-dimou/,Θεσσαλονίκη: Εισαγγελική παρέμβαση για εργατικό ατύχημα στην υπηρεσία καθαριότητας του κεντρικού δήμου,2018-06-29,15:35:33,Κοινωνία,,,"Ποινικές ευθύνες για το εργατικό ατύχημα που σημειώθηκε στο τμήμα καθαριότητας του δήμου Θεσσαλονίκης με θύμα συμβασιούχο εργαζόμενη αναζητεί η Εισαγγελία Πρωτοδικών Θεσσαλονίκης, μέσω προκαταρκτικής εξέτασης που παρήγγειλε ο προϊστάμενός της, Λάμπρος Τσόγκας. Ειδικότερα, με έγγραφη παραγγελία του προς τον εισαγγελέα ποινικής δίωξης, Χρήστο Καραγιάννη, ο αντιεισαγγελέας Εφετών ζητεί να διεξαχθεί έρευνα, από το ΑΤ Λευκού Πύργου, για να διαπιστωθεί εάν τελέστηκε το αδίκημα της σωματικής βλάβης από αμέλεια από υπόχρεο. Το υπό διερεύνηση ατύχημα έγινε γνωστό ύστερα από ανακοίνωση της παράταξης «Δημοκρατική Αγωνιστική Συνεργασία» του δήμου Θεσσαλονίκης, σύμφωνα με την οποία, την ώρα που συνεργείο καθαριότητας πραγματοποιούσε αποκομιδή ανακυκλώσιμων υλικών, εκτοξεύτηκε υγρό, πιθανόν τοξικό, τη στιγμή που η πρέσα του απορριμματοφόρου συμπίεζε τα σκουπίδια. Όπως αναφέρεται στην ίδια ανακοίνωση, η άτυχη γυναίκα υπέστη εγκαύματα και μεταφέρθηκε για νοσηλεία στο Νοσοκομείο «Παπαγεωργίου». Υπό αυτές τις συνθήκες, όπως επισημαίνεται στην εισαγγελική παραγγελία, η προκαταρκτική εξέταση καλείται να δώσει απαντήσεις και στα εξής ερωτήματα: εάν η εργαζόμενη είχε εφοδιαστεί με τα απαιτούμενα προστατευτικά μέτρα για τη σωματική της ακεραιότητα κατά την εκτέλεση της εργασίας της και εάν είχαν δοθεί οι σχετικές οδηγίες για τη διαχείριση της απόθεσης του περιεχομένου των κάδων στο όχημα συλλογής απορριμμάτων του δήμου. Πηγή: ΑΜΠΕ ",https://www.naftemporiki.gr/wp-content/themes/naftemporiki/images/N.PNG,,"Θεσσαλονίκη: Εισαγγελική παρέμβαση για εργατικό ατύχημα στην υπηρεσία καθαριότητας του κεντρικού δήμου Ποινικές ευθύνες για το εργατικό ατύχημα που σημειώθηκε στο τμήμα καθαριότητας του δήμου Θεσσαλονίκης με θύμα συμβασιούχο εργαζόμενη αναζητεί η Εισαγγελία Πρωτοδικών Θεσσαλονίκης, μέσω προκαταρκτικής εξέτασης που παρήγγειλε ο προϊστάμενός της, Λάμπρος Τσόγκας. Ειδικότερα, με έγγραφη παραγγελία του προς τον εισαγγελέα ποινικής δίωξης, Χρήστο Καραγιάννη, ο αντιεισαγγελέας Εφετών ζητεί να διεξαχθεί έρευνα, από το ΑΤ Λευκού Πύργου, για να διαπιστωθεί εάν τελέστηκε το αδίκημα της σωματικής βλάβης από αμέλεια από υπόχρεο. Το υπό διερεύνηση ατύχημα έγινε γνωστό ύστερα από ανακοίνωση της παράταξης «Δημοκρατική Αγωνιστική Συνεργασία» του δήμου Θεσσαλονίκης, σύμφωνα με την οποία, την ώρα που συνεργείο καθαριότητας πραγματοποιούσε αποκομιδή ανακυκλώσιμων υλικών, εκτοξεύτηκε υγρό, πιθανόν τοξικό, τη στιγμή που η πρέσα του απορριμματοφόρου συμπίεζε τα σκουπίδια. Όπως αναφέρεται στην ίδια ανακοίνωση, η άτυχη γυναίκα υπέστη εγκαύματα και μεταφέρθηκε για νοσηλεία στο Νοσοκομείο «Παπαγεωργίου». Υπό αυτές τις συνθήκες, όπως επισημαίνεται στην εισαγγελική παραγγελία, η προκαταρκτική εξέταση καλείται να δώσει απαντήσεις και στα εξής ερωτήματα: εάν η εργαζόμενη είχε εφοδιαστεί με τα απαιτούμενα προστατευτικά μέτρα για τη σωματική της ακεραιότητα κατά την εκτέλεση της εργασίας της και εάν είχαν δοθεί οι σχετικές οδηγίες για τη διαχείριση της απόθεσης του περιεχομένου των κάδων στο όχημα συλλογής απορριμμάτων του δήμου. Πηγή: ΑΜΠΕ ",True
https://www.naftemporiki.gr/society/917206/ag-nikolaos-ergatiko-atychima-me-enan-nekro-kai-dyo-travmaties/,Αγ. Νικόλαος: Εργατικό ατύχημα με έναν νεκρό και δύο τραυματίες,2017-10-23,22:18:24,Κοινωνία,,,"Την τελευταία του πνοή άφησε ένας άνδρας 40 ετών, υπήκοος Αλβανίας, ενώ δύο ακόμη άτομα τραυματίστηκαν όταν ρεύμα διαπέρασε μεγάλη μεταλλική πλάκα που μετέφεραν από κοινού, στον Άγιο Νικόλαο Λασιθίου. Ο άτυχος 40χρονος, παρά τις προσπάθειες των γιατρών στο Γενικό Νοσοκομείο Αγίου Νικολάου, υπέστη καρδιοαναπνευστική ανακοπή. Ο δεύτερος εργαζόμενος νοσηλεύεται με αρρυθμία σε μονάδα εντατικής θεραπείας, ενώ για τον τρίτο, οι γιατροί αναφέρουν ότι έχει ξεπεράσει τον κίνδυνο. Πηγή: ΑΜΠΕ ",https://www.naftemporiki.gr/wp-content/themes/naftemporiki/images/N.PNG,,"Αγ. Νικόλαος: Εργατικό ατύχημα με έναν νεκρό και δύο τραυματίες Την τελευταία του πνοή άφησε ένας άνδρας 40 ετών, υπήκοος Αλβανίας, ενώ δύο ακόμη άτομα τραυματίστηκαν όταν ρεύμα διαπέρασε μεγάλη μεταλλική πλάκα που μετέφεραν από κοινού, στον Άγιο Νικόλαο Λασιθίου. Ο άτυχος 40χρονος, παρά τις προσπάθειες των γιατρών στο Γενικό Νοσοκομείο Αγίου Νικολάου, υπέστη καρδιοαναπνευστική ανακοπή. Ο δεύτερος εργαζόμενος νοσηλεύεται με αρρυθμία σε μονάδα εντατικής θεραπείας, ενώ για τον τρίτο, οι γιατροί αναφέρουν ότι έχει ξεπεράσει τον κίνδυνο. Πηγή: ΑΜΠΕ ",True
https://www.naftemporiki.gr/society/916232/thessaloniki-thanatiforo-ergatiko-atychima-se-oikogeneiako-oinopoieio/,Θεσσαλονίκη: Θανατηφόρο εργατικό ατύχημα σε οικογενειακό οινοποιείο,2017-10-23,15:28:46,Κοινωνία,,,"Τραγικό θάνατο βρήκε 32χρονος μέσα σε καζάνι μούστου σε οικογενειακό οινοποιείο στην επαρχιακή οδό μεταξύ Λαγκαδά και Ασσύρου Θεσσαλονίκης. Η Πυροσβεστική απεγκλώβισε τον άτυχο άνδρα από το καζάνι, ενώ το πλήρωμα του ΕΚΑΒ, που κλήθηκε στο οινοποιείο, διαπίστωσε τον θάνατό του. ",https://www.naftemporiki.gr/wp-content/themes/naftemporiki/images/N.PNG,,"Θεσσαλονίκη: Θανατηφόρο εργατικό ατύχημα σε οικογενειακό οινοποιείο Τραγικό θάνατο βρήκε 32χρονος μέσα σε καζάνι μούστου σε οικογενειακό οινοποιείο στην επαρχιακή οδό μεταξύ Λαγκαδά και Ασσύρου Θεσσαλονίκης. Η Πυροσβεστική απεγκλώβισε τον άτυχο άνδρα από το καζάνι, ενώ το πλήρωμα του ΕΚΑΒ, που κλήθηκε στο οινοποιείο, διαπίστωσε τον θάνατό του. ",True
https://www.naftemporiki.gr/society/702037/thanatiforo-ergatiko-atychima-se-orycheio-stin-kozani/,Θανατηφόρο εργατικό ατύχημα σε ορυχείο στην Κοζάνη,2017-08-19,16:50:47,Κοινωνία,,,"Θανατηφόρο εργατικό ατύχημα σημειώθηκε το Σάββατο στο Ορυχείο Καρδιάς. Ένας 34χρονος, χειριστής ανυψωτικού μηχανήματος (κλαρκ), τραυματίστηκε θανάσιμα, όταν κατά τη διάρκεια προπαρασκευαστικών εργασιών εργολάβου και κάτω από αδιευκρίνιστες, μέχρι στιγμής, συνθήκες καταπλακώθηκε από το μηχάνημα. Τα αίτια του δυστυχήματος διερευνώνται από τις αρμόδιες αρχές. ",https://www.naftemporiki.gr/wp-content/themes/naftemporiki/images/N.PNG,,"Θανατηφόρο εργατικό ατύχημα σε ορυχείο στην Κοζάνη Θανατηφόρο εργατικό ατύχημα σημειώθηκε το Σάββατο στο Ορυχείο Καρδιάς. Ένας 34χρονος, χειριστής ανυψωτικού μηχανήματος (κλαρκ), τραυματίστηκε θανάσιμα, όταν κατά τη διάρκεια προπαρασκευαστικών εργασιών εργολάβου και κάτω από αδιευκρίνιστες, μέχρι στιγμής, συνθήκες καταπλακώθηκε από το μηχάνημα. Τα αίτια του δυστυχήματος διερευνώνται από τις αρμόδιες αρχές. ",True
https://www.naftemporiki.gr/society/323829/ergatiko-atychima-se-oikodomi-sto-irakleio-kritis/,Εργατικό ατύχημα σε οικοδομή στο Ηράκλειο Κρήτης,2017-05-26,15:11:09,Κοινωνία,,,"Εργατικό ατύχημα σημειώθηκε το μεσημέρι σε οικοδομή στη Χανιώπορτα, στην συμβολή της Αρχιεπισκόπου Μακαρίου με την οδό Κισσάμου. Αλλοδαπός 40χρονος εργάτης έπεσε στο κενό από τον τρίτο όροφο του εργοταξίου και μεταφέρθηκε σοβαρά τραυματισμένος μεταφέρθηκε στο Πανεπιστημιακό Νοσοκομείο Ηρακλείου. Στο σημείο έσπευσε και τον παρέλαβε ασθενοφόρο του ΕΚΑΒ, που τον μετέφερε στο νοσοκομείο, ενώ στον τόπο του εργατικού ατυχήματος έσπευσε ο πρόεδρος του Εργατικού Κέντρου Στέλιος Βοργιάς, καθώς και κλιμάκιο από την Επιθεώρηση Εργασίας. Πηγή: ΑΜΠΕ ",https://www.naftemporiki.gr/wp-content/themes/naftemporiki/images/N.PNG,,"Εργατικό ατύχημα σε οικοδομή στο Ηράκλειο Κρήτης Εργατικό ατύχημα σημειώθηκε το μεσημέρι σε οικοδομή στη Χανιώπορτα, στην συμβολή της Αρχιεπισκόπου Μακαρίου με την οδό Κισσάμου. Αλλοδαπός 40χρονος εργάτης έπεσε στο κενό από τον τρίτο όροφο του εργοταξίου και μεταφέρθηκε σοβαρά τραυματισμένος μεταφέρθηκε στο Πανεπιστημιακό Νοσοκομείο Ηρακλείου. Στο σημείο έσπευσε και τον παρέλαβε ασθενοφόρο του ΕΚΑΒ, που τον μετέφερε στο νοσοκομείο, ενώ στον τόπο του εργατικού ατυχήματος έσπευσε ο πρόεδρος του Εργατικού Κέντρου Στέλιος Βοργιάς, καθώς και κλιμάκιο από την Επιθεώρηση Εργασίας. Πηγή: ΑΜΠΕ ",True
https://www.naftemporiki.gr/society/1008336/ergatiko-atychima-sti-nafpigoepiskevastiki-zoni-peramatos/,Εργατικό ατύχημα στη ναυπηγοεπισκευαστική ζώνη Περάματος,2016-10-21,14:37:23,Κοινωνία,,,"Εργατικό ατύχημα σημειώθηκε στη ναυπηγοεπισκευαστική ζώνη Περάματος. Όπως μεταδίδει το ΑΜΠΕ, 43χρονος εργάτης, μέλος συνεργείου, τραυματίστηκε κατά τη διάρκεια εκτέλεσης εργασιών στον καταπέλτη του επιβατηγού οχηματαγωγού πλοίου olumpic champion, που ήταν ελλιμενισμένο στη ναυπηγοεπισκευαστική ζώνη. Ο 43χρονος, σύμφωνα με τις πρώτες πληροφορίες, έχασε την ισορροπία του και έπεσε από ύψος, με αποτέλεσμα να υποστεί κάταγμα στο δεξιό μηρό του κάτω άκρου και θλαστικό τραύμα στο κεφάλι. Ο τραυματίας μεταφέρθηκε στο Αττικό Νοσοκομείο με ασθενοφόρο του ΕΚΑΒ ",https://www.naftemporiki.gr/wp-content/themes/naftemporiki/images/N.PNG,,"Εργατικό ατύχημα στη ναυπηγοεπισκευαστική ζώνη Περάματος Εργατικό ατύχημα σημειώθηκε στη ναυπηγοεπισκευαστική ζώνη Περάματος. Όπως μεταδίδει το ΑΜΠΕ, 43χρονος εργάτης, μέλος συνεργείου, τραυματίστηκε κατά τη διάρκεια εκτέλεσης εργασιών στον καταπέλτη του επιβατηγού οχηματαγωγού πλοίου olumpic champion, που ήταν ελλιμενισμένο στη ναυπηγοεπισκευαστική ζώνη. Ο 43χρονος, σύμφωνα με τις πρώτες πληροφορίες, έχασε την ισορροπία του και έπεσε από ύψος, με αποτέλεσμα να υποστεί κάταγμα στο δεξιό μηρό του κάτω άκρου και θλαστικό τραύμα στο κεφάλι. Ο τραυματίας μεταφέρθηκε στο Αττικό Νοσοκομείο με ασθενοφόρο του ΕΚΑΒ ",True
https://www.naftemporiki.gr/society/825133/irakleio-ypekypse-46chroni-meta-apo-ergatiko-atychima-pou-eiche-ginei-prin-dyo-mines/,Ηράκλειο: Υπέκυψε 46χρονη μετά από εργατικό ατύχημα που είχε γίνει πριν δύο μήνες,2016-08-26,19:48:00,Κοινωνία,,,"Στα τραύματά της υπέκυψε μετά από δύο μήνες νοσηλείας 46χρονη, εργαζόμενη στον δήμο Ηρακλείου, η οποία είχε παρασυρθεί από απορριμματοφόρο ανήμερα του Αγίου Πνεύματος, ενώ βρισκόταν σε συνεργείο αποκομιδής απορριμμάτων. Το εργατικό ατύχημα είχε σημειωθεί στις 20 Ιουνίου, με τη 46χρονη μητέρα τεσσάρων παιδιών από τότε να νοσηλεύεται στη Μονάδα Εντατικής Θεραπείας του Βενιζέλειου Νοσοκομείου με σοβαρά τραύματα. Παρά τις προσπάθειες των γιατρών του νοσοκομείου, η άτυχη γυναίκα άφησε το μεσημέρι της Παρασκευής την τελευταία της πνοή. Πηγή: ΑΜΠΕ ",https://www.naftemporiki.gr/wp-content/themes/naftemporiki/images/N.PNG,,"Ηράκλειο: Υπέκυψε 46χρονη μετά από εργατικό ατύχημα που είχε γίνει πριν δύο μήνες Στα τραύματά της υπέκυψε μετά από δύο μήνες νοσηλείας 46χρονη, εργαζόμενη στον δήμο Ηρακλείου, η οποία είχε παρασυρθεί από απορριμματοφόρο ανήμερα του Αγίου Πνεύματος, ενώ βρισκόταν σε συνεργείο αποκομιδής απορριμμάτων. Το εργατικό ατύχημα είχε σημειωθεί στις 20 Ιουνίου, με τη 46χρονη μητέρα τεσσάρων παιδιών από τότε να νοσηλεύεται στη Μονάδα Εντατικής Θεραπείας του Βενιζέλειου Νοσοκομείου με σοβαρά τραύματα. Παρά τις προσπάθειες των γιατρών του νοσοκομείου, η άτυχη γυναίκα άφησε το μεσημέρι της Παρασκευής την τελευταία της πνοή. Πηγή: ΑΜΠΕ ",True
